# GO	NS	enrichment	name	ratio_in_study	ratio_in_pop	p_uncorrected	depth	study_count	p_bonferroni	p_sidak	p_holm	p_fdr_bh	study_items
GO:0097428	BP	e	protein maturation by iron-sulfur cluster transfer	5/466	6/2550	0.0010201587697092848	6	5	1.0	1.0	1.0	1.0	erpA, hscA, iscA, nfuA, sufA
GO:0046471	BP	e	phosphatidylglycerol metabolic process	4/466	5/2550	0.00471682516496374	7	4	1.0	1.0	1.0	1.0	pgpA, pgsA, pldA, pssA
GO:0032465	BP	e	regulation of cytokinesis	3/466	3/2550	0.006070820759740798	6	3	1.0	1.0	1.0	1.0	sdiA, slmA, sulA
GO:0006650	BP	e	glycerophospholipid metabolic process	7/466	14/2550	0.006832865597283435	6	7	1.0	1.0	1.0	1.0	dgkA, gpsA, pgpA, pgsA, pldA, pssA, rssA
GO:0046486	BP	e	glycerolipid metabolic process	7/466	14/2550	0.006832865597283435	5	7	1.0	1.0	1.0	1.0	dgkA, gpsA, pgpA, pgsA, pldA, pssA, rssA
GO:0015791	BP	e	polyol transport	5/466	8/2550	0.006881546176136595	6	5	1.0	1.0	1.0	1.0	cmtA, gatA, lsrA, mtlA, tqsA
GO:0009438	BP	e	methylglyoxal metabolic process	5/466	8/2550	0.006881546176136595	4	5	1.0	1.0	1.0	1.0	dkgA, gldA, gloA, hchA, mgsA
GO:0009409	BP	e	response to cold	6/466	11/2550	0.007268387046873573	4	6	1.0	1.0	1.0	1.0	cspA, hscA, lepA, otsA, raiA, rbfA
GO:0098662	BP	e	inorganic cation transmembrane transport	27/466	91/2550	0.007978759458588615	7	27	1.0	1.0	1.0	1.0	atpA, ccmA, chaA, cirA, clcA, copA, corA, cvrA, cyoA, dtpA, fecA, fepA, fhuA, fruA, glcA, kdpA, mdfA, mgtA, mngA, nhaA, pitA, pntA, rcnA, setA, sthA, trkA, zntA
GO:1901605	BP	e	alpha-amino acid metabolic process	41/466	156/2550	0.010071456945589703	7	41	1.0	1.0	1.0	1.0	adiA, aegA, alaA, ansA, argA, asnA, aspA, astA, avtA, cadA, carA, dadA, dapA, dsdA, gadA, gdhA, glnA, glyA, guaA, hemA, hisA, ilvA, lysA, metA, nadA, pabA, pheA, proA, putA, puuA, sdaA, selA, serA, speA, sseA, tdcA, thrA, tnaA, trpA, tynA, tyrA
GO:0009065	BP	e	glutamine family amino acid catabolic process	6/466	12/2550	0.012326117327145732	9	6	1.0	1.0	1.0	1.0	adiA, ansA, astA, gadA, putA, speA
GO:0009064	BP	e	glutamine family amino acid metabolic process	16/466	48/2550	0.012502986377614565	8	16	1.0	1.0	1.0	1.0	adiA, aegA, ansA, argA, astA, carA, gadA, gdhA, glnA, guaA, hemA, pabA, proA, putA, puuA, speA
GO:0030004	BP	e	cellular monovalent inorganic cation homeostasis	5/466	9/2550	0.013180871863471213	8	5	1.0	1.0	1.0	1.0	adiA, chaA, gadA, mdfA, nhaA
GO:0098660	BP	e	inorganic ion transmembrane transport	29/466	104/2550	0.01338136170687131	6	29	1.0	1.0	1.0	1.0	atpA, ccmA, chaA, cirA, clcA, copA, corA, cvrA, cyoA, cysA, dtpA, fecA, fepA, fhuA, fruA, glcA, kdpA, mdfA, mgtA, mngA, nhaA, pitA, pntA, pstA, rcnA, setA, sthA, trkA, zntA
GO:0046364	BP	e	monosaccharide biosynthetic process	8/466	19/2550	0.013436278023182164	5	8	1.0	1.0	1.0	1.0	dkgA, fbaA, gpmA, kdsA, maeA, ppsA, sdaA, tpiA
GO:0030001	BP	e	metal ion transport	7/466	16/2550	0.01628562889652928	6	7	1.0	1.0	1.0	1.0	copA, corA, mgtA, nhaA, pitA, zntA, znuA
GO:0006536	BP	e	glutamate metabolic process	7/466	16/2550	0.01628562889652928	9	7	1.0	1.0	1.0	1.0	aegA, astA, gadA, gdhA, glnA, hemA, putA
GO:1901606	BP	e	alpha-amino acid catabolic process	15/466	46/2550	0.018870639508603054	8	15	1.0	1.0	1.0	1.0	adiA, ansA, astA, cadA, dadA, dsdA, gadA, glyA, ilvA, putA, sdaA, speA, tdcA, tnaA, tynA
GO:0009063	BP	e	cellular amino acid catabolic process	17/466	54/2550	0.018918018256902102	7	17	1.0	1.0	1.0	1.0	adiA, ansA, astA, cadA, dadA, dsdA, frlA, gadA, glyA, ilvA, putA, rspA, sdaA, speA, tdcA, tnaA, tynA
GO:0019319	BP	e	hexose biosynthetic process	6/466	13/2550	0.01942504574485341	6	6	1.0	1.0	1.0	1.0	fbaA, gpmA, maeA, ppsA, sdaA, tpiA
GO:0006094	BP	e	gluconeogenesis	6/466	13/2550	0.01942504574485341	7	6	1.0	1.0	1.0	1.0	fbaA, gpmA, maeA, ppsA, sdaA, tpiA
GO:0010447	BP	e	response to acidic pH	6/466	13/2550	0.01942504574485341	4	6	1.0	1.0	1.0	1.0	clcA, focA, hchA, hdeA, safA, sodA
GO:0098743	BP	e	cell aggregation	10/466	27/2550	0.020469532706915986	2	10	1.0	1.0	1.0	1.0	ackA, bhsA, bsmA, csgA, hipA, pgaA, surA, tabA, tqsA, ttdA
GO:0042710	BP	e	biofilm formation	10/466	27/2550	0.020469532706915986	4	10	1.0	1.0	1.0	1.0	ackA, bhsA, bsmA, csgA, hipA, pgaA, surA, tabA, tqsA, ttdA
GO:0098630	BP	e	aggregation of unicellular organisms	10/466	27/2550	0.020469532706915986	3	10	1.0	1.0	1.0	1.0	ackA, bhsA, bsmA, csgA, hipA, pgaA, surA, tabA, tqsA, ttdA
GO:1901654	BP	e	response to ketone	3/466	4/2550	0.020972576311279804	4	3	1.0	1.0	1.0	1.0	hchA, marA, tktA
GO:0006655	BP	e	phosphatidylglycerol biosynthetic process	3/466	4/2550	0.020972576311279804	8	3	1.0	1.0	1.0	1.0	pgpA, pgsA, pssA
GO:0045017	BP	e	glycerolipid biosynthetic process	5/466	10/2550	0.022462522935208958	6	5	1.0	1.0	1.0	1.0	dgkA, gpsA, pgpA, pgsA, pssA
GO:0046474	BP	e	glycerophospholipid biosynthetic process	5/466	10/2550	0.022462522935208958	7	5	1.0	1.0	1.0	1.0	dgkA, gpsA, pgpA, pgsA, pssA
GO:0055067	BP	e	monovalent inorganic cation homeostasis	5/466	10/2550	0.022462522935208958	7	5	1.0	1.0	1.0	1.0	adiA, chaA, gadA, mdfA, nhaA
GO:0051596	BP	e	methylglyoxal catabolic process	4/466	7/2550	0.024211509268349744	5	4	1.0	1.0	1.0	1.0	dkgA, gldA, gloA, hchA
GO:0015850	BP	e	organic hydroxy compound transport	10/466	29/2550	0.0301890551242331	5	10	1.0	1.0	1.0	1.0	acrA, cmtA, fepA, gatA, glcA, lsrA, mdtA, mtlA, shiA, tqsA
GO:0042221	BP	e	response to chemical	50/466	209/2550	0.031518451990992465	2	50	1.0	1.0	1.0	1.0	acrA, alaA, amiA, appA, arnA, bacA, barA, bhsA, bsmA, clcA, copA, cutA, dsbA, eamA, ecnA, eptA, ftnA, gloA, gshA, gyrA, hchA, hdeA, hipA, macA, marA, mdfA, mepA, mgtA, modA, mprA, mrcA, mrdA, msrA, pgpA, priA, qorA, rcnA, rsmA, sanA, sbmA, setA, sodA, sseA, tehA, tktA, tolA, treA, tsgA, tufA, zntA
GO:0050896	BP	e	response to stimulus	116/466	540/2550	0.0329283264425931	1	116	1.0	1.0	1.0	1.0	acnA, acrA, alaA, alkA, amiA, appA, arnA, asnA, bacA, barA, betA, bhsA, bsmA, cheA, clcA, clpA, copA, cpxA, cspA, cstA, cutA, dctA, ddlA, deoA, dgkA, dksA, dsbA, dsdA, eamA, ecnA, eptA, feoA, focA, frdA, ftnA, gcvA, glgA, glnA, gloA, gshA, gyrA, hchA, hdeA, hipA, hisA, hscA, hupA, ibpA, ldhA, lepA, lexA, ligA, macA, marA, mdfA, mepA, mglA, mgtA, miaA, moaA, modA, mprA, mrcA, mrdA, msrA, nfuA, nhaA, ompA, oppA, otsA, pflA, pgpA, polA, pphA, priA, pspA, pstA, purA, putA, qorA, queA, radA, raiA, rbfA, rcnA, rcsA, recA, relA, rsmA, ruvA, safA, sanA, sbmA, seqA, setA, slyA, sodA, solA, sseA, sspA, sufA, sulA, tauA, tehA, thyA, tktA, tolA, tqsA, treA, tsgA, tufA, uvrA, uxuA, wrbA, xthA, zntA
GO:2000765	BP	e	regulation of cytoplasmic translation	2/466	2/2550	0.03333717951680863	8	2	1.0	1.0	1.0	1.0	miaA, rpsA
GO:0061718	BP	e	glucose catabolic process to pyruvate	2/466	2/2550	0.03333717951680863	8	2	1.0	1.0	1.0	1.0	gpmA, pfkA
GO:0072756	BP	e	cellular response to paraquat	2/466	2/2550	0.03333717951680863	5	2	1.0	1.0	1.0	1.0	marA, tktA
GO:0015797	BP	e	mannitol transport	2/466	2/2550	0.03333717951680863	7	2	1.0	1.0	1.0	1.0	cmtA, mtlA
GO:0031333	BP	e	negative regulation of protein-containing complex assembly	2/466	2/2550	0.03333717951680863	6	2	1.0	1.0	1.0	1.0	slmA, sulA
GO:0006542	BP	e	glutamine biosynthetic process	2/466	2/2550	0.03333717951680863	10	2	1.0	1.0	1.0	1.0	glnA, puuA
GO:0032466	BP	e	negative regulation of cytokinesis	2/466	2/2550	0.03333717951680863	7	2	1.0	1.0	1.0	1.0	slmA, sulA
GO:0009050	BP	e	glycopeptide catabolic process	2/466	2/2550	0.03333717951680863	7	2	1.0	1.0	1.0	1.0	ldcA, mpaA
GO:0032271	BP	e	regulation of protein polymerization	2/466	2/2550	0.03333717951680863	6	2	1.0	1.0	1.0	1.0	slmA, sulA
GO:0009404	BP	e	toxin metabolic process	2/466	2/2550	0.03333717951680863	3	2	1.0	1.0	1.0	1.0	cbrA, cvpA
GO:1903830	BP	e	magnesium ion transmembrane transport	2/466	2/2550	0.03333717951680863	8	2	1.0	1.0	1.0	1.0	corA, mgtA
GO:0015693	BP	e	magnesium ion transport	2/466	2/2550	0.03333717951680863	7	2	1.0	1.0	1.0	1.0	corA, mgtA
GO:1901655	BP	e	cellular response to ketone	2/466	2/2550	0.03333717951680863	5	2	1.0	1.0	1.0	1.0	marA, tktA
GO:0045786	BP	e	negative regulation of cell cycle	2/466	2/2550	0.03333717951680863	5	2	1.0	1.0	1.0	1.0	slmA, sulA
GO:0006735	BP	e	NADH regeneration	2/466	2/2550	0.03333717951680863	3	2	1.0	1.0	1.0	1.0	gpmA, pfkA
GO:1905887	BP	e	autoinducer AI-2 transmembrane transport	2/466	2/2550	0.03333717951680863	7	2	1.0	1.0	1.0	1.0	lsrA, tqsA
GO:0032272	BP	e	negative regulation of protein polymerization	2/466	2/2550	0.03333717951680863	7	2	1.0	1.0	1.0	1.0	slmA, sulA
GO:0036245	BP	e	cellular response to menadione	2/466	2/2550	0.03333717951680863	6	2	1.0	1.0	1.0	1.0	marA, tktA
GO:0106035	BP	e	protein maturation by [4Fe-4S] cluster transfer	2/466	2/2550	0.03333717951680863	7	2	1.0	1.0	1.0	1.0	erpA, nfuA
GO:0010948	BP	e	negative regulation of cell cycle process	2/466	2/2550	0.03333717951680863	6	2	1.0	1.0	1.0	1.0	slmA, sulA
GO:0043087	BP	e	regulation of GTPase activity	2/466	2/2550	0.03333717951680863	5	2	1.0	1.0	1.0	1.0	slmA, sulA
GO:0061620	BP	e	glycolytic process through glucose-6-phosphate	2/466	2/2550	0.03333717951680863	14	2	1.0	1.0	1.0	1.0	gpmA, pfkA
GO:0061621	BP	e	canonical glycolysis	2/466	2/2550	0.03333717951680863	15	2	1.0	1.0	1.0	1.0	gpmA, pfkA
GO:0044036	BP	e	cell wall macromolecule metabolic process	13/466	40/2550	0.03589740224252796	5	13	1.0	1.0	1.0	1.0	bacA, dacA, ddlA, emtA, ldcA, manA, mepA, mipA, mpaA, mrcA, mrdA, mtgA, murA
GO:0010035	BP	e	response to inorganic substance	17/466	58/2550	0.03758842945324161	3	17	1.0	1.0	1.0	1.0	barA, bhsA, bsmA, copA, cutA, eamA, ftnA, gshA, mgtA, modA, pgpA, rcnA, sodA, tehA, tktA, tsgA, zntA
GO:0042182	BP	e	ketone catabolic process	4/466	8/2550	0.041541472360463474	4	4	1.0	1.0	1.0	1.0	dkgA, gldA, gloA, hchA
GO:0044718	BP	e	siderophore transmembrane transport	4/466	8/2550	0.041541472360463474	10	4	1.0	1.0	1.0	1.0	cirA, fecA, fepA, fhuA
GO:0015675	BP	e	nickel cation transport	4/466	8/2550	0.041541472360463474	7	4	1.0	1.0	1.0	1.0	corA, nikA, rcnA, zntA
GO:0071236	BP	e	cellular response to antibiotic	4/466	8/2550	0.041541472360463474	4	4	1.0	1.0	1.0	1.0	amiA, dsbA, tktA, tolA
GO:0030641	BP	e	regulation of cellular pH	4/466	8/2550	0.041541472360463474	9	4	1.0	1.0	1.0	1.0	adiA, gadA, mdfA, nhaA
GO:0046677	BP	e	response to antibiotic	23/466	84/2550	0.04291725873871503	3	23	1.0	1.0	1.0	1.0	acrA, alaA, amiA, arnA, bacA, dsbA, eptA, gyrA, hipA, macA, marA, mdfA, mprA, mrcA, mrdA, priA, rsmA, sbmA, sseA, tehA, tktA, tolA, tufA
GO:0070887	BP	e	cellular response to chemical stimulus	18/466	62/2550	0.0437783402489763	3	18	1.0	1.0	1.0	1.0	amiA, appA, clcA, copA, dsbA, eamA, ftnA, gshA, hdeA, marA, mgtA, msrA, qorA, setA, sodA, tktA, tolA, treA
GO:0051726	BP	e	regulation of cell cycle	3/466	5/2550	0.0453562030308466	4	3	1.0	1.0	1.0	1.0	sdiA, slmA, sulA
GO:0045947	BP	e	negative regulation of translational initiation	3/466	5/2550	0.0453562030308466	9	3	1.0	1.0	1.0	1.0	csrA, raiA, rplA
GO:0010564	BP	e	regulation of cell cycle process	3/466	5/2550	0.0453562030308466	5	3	1.0	1.0	1.0	1.0	sdiA, slmA, sulA
GO:0006446	BP	e	regulation of translational initiation	3/466	5/2550	0.0453562030308466	8	3	1.0	1.0	1.0	1.0	csrA, raiA, rplA
GO:0006824	BP	e	cobalt ion transport	3/466	5/2550	0.0453562030308466	8	3	1.0	1.0	1.0	1.0	corA, rcnA, zntA
GO:0042851	BP	e	L-alanine metabolic process	3/466	5/2550	0.0453562030308466	10	3	1.0	1.0	1.0	1.0	alaA, avtA, dadA
GO:0006565	BP	e	L-serine catabolic process	3/466	5/2550	0.0453562030308466	10	3	1.0	1.0	1.0	1.0	dsdA, glyA, sdaA
GO:0043038	BP	p	amino acid activation	0/466	25/2550	0.008814457984662813	7	0	1.0	1.0	1.0	1.0	
GO:0006418	BP	p	tRNA aminoacylation for protein translation	0/466	24/2550	0.01406560356149378	10	0	1.0	1.0	1.0	1.0	
GO:0043039	BP	p	tRNA aminoacylation	0/466	24/2550	0.01406560356149378	9	0	1.0	1.0	1.0	1.0	
GO:0072329	BP	p	monocarboxylic acid catabolic process	7/466	81/2550	0.01927849593427273	7	7	1.0	1.0	1.0	1.0	dgoA, fadA, hdhA, mhpA, paaA, uxaA, uxuA
GO:0006412	BP	p	translation	9/466	94/2550	0.028508281770379666	7	9	1.0	1.0	1.0	1.0	fusA, infA, lepA, prfA, rplA, rpmA, rpsA, selA, tufA
GO:0043043	BP	p	peptide biosynthetic process	11/466	105/2550	0.03815215835130721	6	11	1.0	1.0	1.0	1.0	entA, fusA, gshA, infA, lepA, prfA, rplA, rpmA, rpsA, selA, tufA
GO:0110165	CC	e	cellular anatomical entity	375/466	1887/2550	0.00035954154443360785	1	375	0.0913235522861364	0.08902993531821228	0.0913235522861364	0.07368539522582569	aaeA, abgA, accA, ackA, acnA, acrA, adiA, alaA, aldA, alkA, amiA, amyA, ansA, aphA, appA, araA, arcA, argA, aroA, asmA, asnA, aspA, atpA, avtA, bacA, bamA, barA, bcsA, betA, bglA, bhsA, bioA, birA, bolA, bsmA, cadA, caiA, carA, cbpA, ccmA, chaA, chbA, cheA, cirA, clcA, clpA, cmoA, cmtA, coaA, copA, corA, cpxA, csgA, cspA, csrA, cstA, cutA, cvpA, cvrA, cyaA, cycA, cydA, cyoA, cysA, dacA, dadA, dapA, dbpA, dctA, dcuA, ddlA, ddpA, dedA, deoA, dgkA, djlA, dkgA, dksA, dmlA, dmsA, dnaA, dpiA, dppA, dsbA, dsdA, dtpA, dusA, eamA, ecnA, emtA, endA, entA, eptA, erpA, evgA, fabA, fadA, fbaA, fdrA, fecA, feoA, fepA, fhlA, fhuA, fkpA, fldA, flhA, fliA, focA, frdA, frlA, frmA, fruA, frvA, fryA, fsaA, ftnA, ftsA, fucA, fusA, fxsA, gadA, gapA, gatA, gcvA, gdhA, gfcA, ghrA, glcA, gldA, glgA, glnA, gloA, glpA, gltA, glyA, gnsA, gpmA, gpsA, greA, gshA, gsiA, guaA, gyrA, hchA, hdeA, hdhA, hipA, hisA, hokA, hrpA, hscA, hsrA, hupA, hyaA, hybA, hypA, hyuA, iaaA, iadA, ibpA, ihfA, infA, iscA, ispA, kdpA, kdsA, lacA, ldcA, ldhA, lepA, leuA, lexA, lfhA, ligA, lipA, lolA, lplA, lptA, lpxA, lspA, lsrA, macA, maeA, manA, mcbA, mdfA, mdlA, mdtA, melA, menA, mepA, metA, mglA, mgsA, mgtA, mipA, mlaA, mltA, mngA, mnmA, mobA, modA, moeA, motA, mpaA, mppA, mprA, mrcA, mrdA, msbA, msrA, mtfA, mtgA, mtlA, murA, mzrA, nadA, nanA, napA, nemA, nfrA, nfsA, nfuA, nhaA, nhoA, nikA, nlpA, nrdA, nrfA, nuoA, nusA, ompA, oppA, otsA, paaA, paoA, patA, pdxA, pepA, pfkA, pflA, pgaA, pgpA, pgsA, pheA, phoA, pitA, pldA, pmbA, pntA, polA, potA, ppdA, ppiA, pppA, ppsA, pptA, pqiA, prfA, prmA, proA, pspA, pssA, pstA, ptrA, ptsA, purA, putA, pykA, qmcA, qorA, queA, raiA, rapA, ravA, rbbA, rbfA, rbsA, rcnA, recA, rhaA, rhtA, ribA, rihA, rlpA, rnhA, rpiA, rplA, rpmA, rpoA, rpsA, rraA, rseA, rsgA, rsmA, rstA, rsuA, rsxA, rtcA, ruvA, safA, sanA, sapA, sbmA, sdaA, sdhA, secA, selA, seqA, serA, setA, sfmA, shiA, sixA, slmA, sodA, solA, speA, sppA, srlA, sseA, sspA, ssuA, sthA, stpA, sucA, sufA, surA, tabA, talA, tatA, tauA, tdcA, tehA, tesA, thyA, tktA, tmcA, tnaA, tolA, topA, torA, tpiA, tqsA, treA, trkA, trmA, trpA, trxA, tsgA, ttcA, tufA, tynA, tyrA, ubiA, ugpA, uhpA, uidA, ulaA, uraA, ushA, uspA, uvrA, viaA, waaA, wrbA, xapA, xseA, xthA, xylA, zapA, zipA, zntA, znuA
GO:0005575	CC	e	cellular_component	384/466	1948/2550	0.0005801999624080763	0	384	0.14737079045165138	0.14366953116973874	0.1467905904892433	0.07368539522582569	aaeA, abgA, accA, ackA, acnA, acrA, adiA, alaA, aldA, alkA, amiA, amyA, ansA, aphA, appA, araA, arcA, argA, arnA, aroA, asmA, asnA, aspA, atpA, avtA, bacA, bamA, barA, bcsA, betA, bglA, bhsA, bioA, birA, bolA, bsmA, cadA, caiA, carA, cbpA, ccmA, chaA, chbA, cheA, cirA, clcA, clpA, cmoA, cmtA, coaA, copA, corA, cpxA, csgA, cspA, csrA, cstA, cutA, cvpA, cvrA, cyaA, cycA, cydA, cyoA, cysA, dacA, dadA, dapA, dbpA, dctA, dcuA, ddlA, ddpA, dedA, deoA, dgkA, djlA, dkgA, dksA, dmlA, dmsA, dnaA, dpiA, dppA, dsbA, dsdA, dtpA, dusA, eamA, ebgA, ecnA, emtA, endA, entA, eptA, erpA, evgA, fabA, fadA, fbaA, fdrA, fecA, feoA, fepA, fhlA, fhuA, fkpA, fldA, flhA, fliA, focA, frdA, frlA, frmA, fruA, frvA, fryA, fsaA, ftnA, ftsA, fucA, fusA, fxsA, gadA, gapA, gatA, gcvA, gdhA, gfcA, ghrA, glcA, gldA, glgA, glnA, gloA, glpA, gltA, glyA, gnsA, gpmA, gpsA, greA, gshA, gsiA, guaA, gyrA, hchA, hdeA, hdhA, hipA, hisA, hokA, holA, hrpA, hscA, hsrA, hupA, hyaA, hybA, hyfA, hypA, hyuA, iaaA, iadA, ibpA, ihfA, infA, iscA, ispA, kdpA, kdsA, lacA, ldcA, ldhA, lepA, leuA, lexA, lfhA, ligA, lipA, lolA, lplA, lptA, lpxA, lspA, lsrA, macA, maeA, manA, marA, mcbA, mdfA, mdlA, mdtA, melA, menA, mepA, metA, mglA, mgsA, mgtA, mipA, mlaA, mltA, mngA, mnmA, moaA, mobA, modA, moeA, motA, mpaA, mppA, mprA, mrcA, mrdA, msbA, msrA, mtfA, mtgA, mtlA, murA, mzrA, nadA, nanA, napA, nemA, nfrA, nfsA, nfuA, nhaA, nhoA, nikA, nlpA, nrdA, nrfA, nuoA, nusA, ompA, oppA, otsA, paaA, paoA, patA, pdxA, pepA, pfkA, pflA, pgaA, pgpA, pgsA, pheA, phoA, pitA, pldA, pmbA, pntA, polA, potA, ppdA, ppiA, pppA, ppsA, pptA, pqiA, prfA, priA, prmA, proA, pspA, pssA, pstA, ptrA, ptsA, purA, putA, pykA, qmcA, qorA, queA, raiA, rapA, rarA, ravA, rbbA, rbfA, rbsA, rcnA, recA, rhaA, rhtA, ribA, rihA, rlpA, rnhA, rnpA, rpiA, rplA, rpmA, rpoA, rpsA, rraA, rseA, rsgA, rsmA, rstA, rsuA, rsxA, rtcA, ruvA, safA, sanA, sapA, sbmA, sdaA, sdhA, secA, selA, seqA, serA, setA, sfmA, shiA, sixA, slmA, sodA, solA, speA, sppA, srlA, sseA, sspA, ssuA, sthA, stpA, sucA, sufA, surA, tabA, talA, tatA, tauA, tdcA, tehA, tesA, thyA, tktA, tmcA, tnaA, tolA, topA, torA, tpiA, tqsA, treA, trkA, trmA, trpA, trxA, tsgA, ttcA, tufA, tynA, tyrA, ubiA, ugpA, uhpA, uidA, ulaA, uraA, ushA, uspA, uvrA, viaA, waaA, wrbA, xapA, xseA, xthA, xylA, zapA, zipA, zntA, znuA
GO:0005829	CC	e	cytosol	168/466	770/2550	0.0025830100279591885	2	168	0.6560845471016339	0.6396067972555676	0.6509185270457155	0.1443619571750652	accA, ackA, acnA, adiA, aldA, ansA, araA, arcA, aroA, asnA, aspA, avtA, bglA, bolA, carA, ccmA, chbA, cheA, clpA, cmoA, cpxA, cspA, csrA, dapA, ddlA, deoA, dkgA, dksA, dnaA, dsdA, dusA, entA, erpA, evgA, fabA, fbaA, fdrA, fhlA, fldA, fliA, frdA, frmA, ftnA, ftsA, fucA, fusA, gadA, gapA, gatA, gdhA, ghrA, gldA, glgA, glnA, gloA, glpA, gltA, glyA, gnsA, gpmA, gpsA, greA, gshA, guaA, gyrA, hchA, hdhA, hipA, hisA, hscA, hupA, iadA, ibpA, ihfA, infA, iscA, ispA, kdsA, ldcA, ldhA, lepA, leuA, lexA, ligA, lipA, lplA, lpxA, maeA, manA, melA, mgsA, mnmA, moeA, mprA, msrA, mtfA, murA, nadA, nanA, nemA, nfsA, nfuA, nrdA, nusA, otsA, paaA, patA, pfkA, pflA, pmbA, polA, ppsA, prfA, prmA, proA, pspA, pssA, purA, putA, pykA, qmcA, qorA, queA, raiA, ravA, rbfA, ribA, rihA, rpiA, rplA, rpoA, rraA, rsgA, rsmA, rstA, rsuA, sdaA, secA, selA, seqA, serA, sodA, solA, sseA, sspA, sthA, stpA, sucA, sufA, tabA, talA, tatA, tdcA, thyA, tktA, topA, tpiA, trkA, trmA, trpA, trxA, ttcA, uidA, uvrA, viaA, wrbA, xthA, zapA
GO:0005737	CC	e	cytoplasm	155/466	702/2550	0.002817150640428286	2	155	0.7155562626687846	0.6975848637856222	0.7071048107474998	0.1443619571750652	abgA, accA, ackA, acnA, adiA, alaA, alkA, amyA, ansA, araA, arcA, argA, aroA, asnA, avtA, bioA, birA, cadA, caiA, carA, cbpA, chbA, cheA, clpA, coaA, copA, cspA, csrA, cutA, cyaA, dadA, dapA, dbpA, ddlA, dkgA, dksA, dmlA, dnaA, dpiA, dsdA, evgA, fabA, fadA, feoA, fldA, fliA, frmA, frvA, fryA, fsaA, ftnA, fusA, gapA, gatA, gcvA, gdhA, ghrA, glnA, gloA, gltA, glyA, gpsA, gyrA, hchA, hisA, hupA, hyuA, iaaA, iadA, ibpA, ihfA, infA, iscA, ispA, kdsA, lacA, ldcA, lipA, lplA, lpxA, manA, metA, mgsA, mnmA, mobA, moeA, mpaA, msrA, mtfA, murA, nadA, nanA, nhoA, nusA, pdxA, pepA, pfkA, pflA, pheA, pmbA, polA, pptA, prfA, prmA, proA, pspA, pssA, ptrA, ptsA, purA, pykA, qorA, queA, rapA, ravA, rbfA, recA, rhaA, rnhA, rpoA, rpsA, rraA, rsgA, rsmA, rstA, rtcA, ruvA, secA, selA, seqA, sixA, slmA, sodA, sseA, sthA, stpA, sufA, talA, tdcA, thyA, tmcA, tnaA, tpiA, trpA, trxA, ttcA, tufA, tyrA, uhpA, uspA, uvrA, xapA, xseA, xylA, zapA
GO:0042597	CC	e	periplasmic space	44/466	172/2550	0.013850216679101954	2	44	1.0	1.0	1.0	0.45462055923097044	acrA, amiA, aphA, appA, asmA, cpxA, dacA, ddpA, dmsA, dppA, dsbA, endA, fkpA, hdeA, hybA, lolA, lptA, mcbA, mepA, mltA, modA, mppA, mrdA, napA, nikA, nrfA, ompA, oppA, paoA, phoA, ppiA, ptrA, sanA, sapA, speA, ssuA, surA, tauA, tesA, torA, treA, tynA, ushA, znuA
GO:0030288	CC	e	outer membrane-bounded periplasmic space	36/466	139/2550	0.023308850423618865	3	36	1.0	1.0	1.0	0.5920448007599192	acrA, amiA, aphA, appA, cpxA, dacA, ddpA, dmsA, dppA, dsbA, fkpA, hdeA, lolA, lptA, mepA, mltA, modA, mppA, mrdA, napA, nikA, nrfA, ompA, oppA, phoA, ppiA, ptrA, sanA, sapA, ssuA, surA, tauA, tesA, torA, treA, ushA
GO:0060187	CC	e	cell pole	3/466	5/2550	0.0453562030308466	2	3	1.0	1.0	1.0	0.8782708750623013	pspA, rbbA, tnaA
GO:1990281	CC	e	efflux pump complex	3/466	5/2550	0.0453562030308466	4	3	1.0	1.0	1.0	0.8782708750623013	acrA, macA, mdtA
GO:0043228	CC	p	non-membrane-bounded organelle	7/466	96/2550	0.0028417708105327793	3	7	0.721809785875326	0.7036813279797098	0.7104427026331949	0.1443619571750652	gyrA, hrpA, rplA, rpmA, rpsA, slmA, topA
GO:0005840	CC	p	ribosome	3/466	56/2550	0.008044331948837998	5	3	1.0	1.0	1.0	0.3405433858341419	rplA, rpmA, rpsA
GO:0043226	CC	p	organelle	10/466	106/2550	0.014318757771054187	2	10	1.0	1.0	1.0	0.45462055923097044	gyrA, hrpA, lipA, mgtA, prfA, rplA, rpmA, rpsA, slmA, topA
GO:0009288	CC	p	bacterial-type flagellum	0/466	21/2550	0.02188220395614061	4	0	1.0	1.0	1.0	0.5920448007599192	
GO:0043232	CC	p	intracellular non-membrane-bounded organelle	7/466	75/2550	0.047308696166799696	4	7	1.0	1.0	1.0	0.8782708750623013	gyrA, hrpA, rplA, rpmA, rpsA, slmA, topA
GO:0055052	CC	p	ATP-binding cassette (ABC) transporter complex, substrate-binding subunit-containing	1/466	29/2550	0.04840863090894574	6	1	1.0	1.0	1.0	0.8782708750623013	ugpA
GO:0051287	MF	e	NAD binding	17/466	44/2550	0.0012399890059333499	5	17	1.0	1.0	1.0	1.0	arnA, dmlA, gapA, ghrA, gltA, gpsA, hdhA, ldhA, ligA, maeA, melA, pdxA, pntA, serA, trkA, tyrA, wrbA
GO:0003824	MF	e	catalytic activity	282/466	1378/2550	0.002024038358785938	1	282	1.0	1.0	1.0	1.0	abgA, accA, aceA, ackA, acnA, adiA, aegA, alaA, aldA, alkA, allA, amiA, amyA, ansA, aphA, appA, araA, argA, arnA, aroA, asnA, aspA, astA, atpA, avtA, bacA, barA, bcsA, betA, bglA, bioA, birA, cadA, caiA, carA, cbrA, chbA, cheA, clpA, cmoA, cmtA, coaA, codA, cpdA, cpxA, csdA, cyaA, cydA, cyoA, dacA, dadA, dapA, dbpA, ddlA, deoA, dgkA, dgoA, dkgA, dmlA, dmsA, dsbA, dsdA, dusA, ebgA, elaA, emtA, endA, entA, eptA, fabA, fadA, fbaA, fdrA, fixA, fkpA, fldA, fliA, frdA, frmA, frsA, fruA, frvA, fryA, fsaA, ftnA, fucA, fumA, fusA, gadA, gapA, gatA, gdhA, ghrA, gldA, glgA, glnA, gloA, glpA, gltA, glyA, gpmA, gpsA, grxA, gshA, gsiA, guaA, gyrA, hchA, hdhA, hemA, hipA, hisA, holA, hrpA, hyaA, hybA, hyfA, hyuA, iaaA, iadA, ilvA, ispA, kdsA, kptA, lacA, ldcA, ldhA, lepA, leuA, lexA, ligA, lipA, lplA, lpxA, lspA, lsrA, lysA, maeA, manA, melA, menA, mepA, metA, mgsA, mhpA, miaA, mltA, mngA, mnmA, moaA, mobA, mocA, moeA, mpaA, mrcA, mrdA, msrA, mtfA, mtgA, mtlA, murA, nadA, nagA, nanA, napA, nemA, nfsA, nhoA, nrdA, nrfA, nuoA, otsA, paaA, pabA, paoA, patA, pdxA, pepA, pfkA, pflA, pgpA, pgsA, pheA, phoA, pldA, pmbA, pncA, pntA, polA, pphA, ppiA, pppA, ppsA, pptA, priA, prmA, proA, pssA, ptrA, ptsA, purA, putA, puuA, pykA, qorA, queA, radA, rapA, rarA, ravA, rbbA, recA, relA, rhaA, ribA, rihA, rlmA, rlpA, rluA, rnhA, rnpA, rpiA, rpoA, rsgA, rsmA, rssA, rsuA, rtcA, rutA, ruvA, sdaA, sdhA, selA, serA, sixA, sodA, solA, speA, sppA, sseA, ssnA, sthA, sucA, surA, tadA, talA, tesA, thrA, thyA, tktA, tmcA, tnaA, topA, torA, tpiA, treA, trmA, trpA, truA, trxA, ttcA, ttdA, tufA, tynA, tyrA, ubiA, ucpA, uidA, ulaA, ushA, uvrA, uxaA, uxuA, waaA, wcaA, wrbA, xapA, xdhA, xseA, xthA, xylA, zntA
GO:0070403	MF	e	NAD+ binding	5/466	7/2550	0.003034144470912581	6	5	1.0	1.0	1.0	1.0	arnA, ligA, melA, serA, tyrA
GO:0042802	MF	e	identical protein binding	84/466	349/2550	0.003561591603824005	3	84	1.0	1.0	1.0	1.0	accA, acrA, aldA, ansA, aphA, arcA, arnA, asnA, cadA, clcA, codA, cpxA, csgA, dapA, dgkA, diaA, dnaA, entA, fbaA, fhlA, focA, frmA, ftnA, ftsA, fumA, gdhA, gldA, glnA, gltA, glyA, gnsA, guaA, gyrA, hdeA, hdhA, hemA, hupA, hyuA, iadA, ibpA, kdsA, lacA, lepA, lexA, lptA, lpxA, macA, moeA, msbA, nanA, nrdA, ompA, patA, pdxA, pfkA, proA, pspA, putA, pykA, qmcA, ravA, rhaA, rihA, rpiA, ruvA, secA, selA, seqA, serA, slmA, sthA, sucA, tatA, tehA, tesA, tnaA, tpiA, uidA, ulaA, uspA, uvrA, wrbA, xapA, zapA
GO:0035251	MF	e	UDP-glucosyltransferase activity	3/466	3/2550	0.006070820759740798	6	3	1.0	1.0	1.0	1.0	bcsA, glgA, otsA
GO:0046527	MF	e	glucosyltransferase activity	3/466	3/2550	0.006070820759740798	5	3	1.0	1.0	1.0	1.0	bcsA, glgA, otsA
GO:0070404	MF	e	NADH binding	3/466	3/2550	0.006070820759740798	6	3	1.0	1.0	1.0	1.0	gltA, ldhA, serA
GO:0016860	MF	e	intramolecular oxidoreductase activity	11/466	28/2550	0.010632440106803448	3	11	1.0	1.0	1.0	1.0	araA, dsbA, fabA, fumA, hisA, manA, pptA, rhaA, rpiA, tpiA, xylA
GO:1904680	MF	e	peptide transmembrane transporter activity	12/466	33/2550	0.011555455129566338	4	12	1.0	1.0	1.0	1.0	cirA, ddpA, dppA, dtpA, fepA, gsiA, macA, mppA, nikA, oppA, sapA, sbmA
GO:0005451	MF	e	monovalent cation:proton antiporter activity	4/466	6/2550	0.012110157955490185	8	4	1.0	1.0	1.0	1.0	chaA, cvrA, mdfA, nhaA
GO:0042626	MF	e	ATPase-coupled transmembrane transporter activity	20/466	65/2550	0.013613757916433806	5	20	1.0	1.0	1.0	1.0	atpA, ccmA, clcA, copA, cysA, gsiA, kdpA, lsrA, mdlA, mglA, mgtA, modA, msbA, potA, ravA, rbsA, sbmA, secA, ssuA, zntA
GO:0016298	MF	e	lipase activity	3/466	4/2550	0.020972576311279804	4	3	1.0	1.0	1.0	1.0	pldA, rssA, tesA
GO:0004622	MF	e	lysophospholipase activity	3/466	4/2550	0.020972576311279804	6	3	1.0	1.0	1.0	1.0	pldA, rssA, tesA
GO:0016211	MF	e	ammonia ligase activity	3/466	4/2550	0.020972576311279804	5	3	1.0	1.0	1.0	1.0	asnA, glnA, puuA
GO:0015386	MF	e	potassium:proton antiporter activity	3/466	4/2550	0.020972576311279804	9	3	1.0	1.0	1.0	1.0	chaA, cvrA, mdfA
GO:0004620	MF	e	phospholipase activity	3/466	4/2550	0.020972576311279804	5	3	1.0	1.0	1.0	1.0	pldA, rssA, tesA
GO:0022821	MF	e	potassium ion antiporter activity	3/466	4/2550	0.020972576311279804	8	3	1.0	1.0	1.0	1.0	chaA, cvrA, mdfA
GO:0005509	MF	e	calcium ion binding	5/466	10/2550	0.022462522935208958	5	5	1.0	1.0	1.0	1.0	amyA, nrfA, pldA, rihA, tynA
GO:0015662	MF	e	P-type ion transporter activity	4/466	7/2550	0.024211509268349744	7	4	1.0	1.0	1.0	1.0	copA, kdpA, mgtA, zntA
GO:0140358	MF	e	P-type transmembrane transporter activity	4/466	7/2550	0.024211509268349744	6	4	1.0	1.0	1.0	1.0	copA, kdpA, mgtA, zntA
